{
  "scan_id": "scan-pr5-synthetic-windows-apps",
  "timestamp": "2026-07-06T00:00:00Z",
  "platform": "Windows",
  "privacy_mode": "offline",
  "software_entries": [
    {
      "target_id": "WINDOWS_APP:dc6fc68e0403d0c7c0cb",
      "id": "WINDOWS_APP:dc6fc68e0403d0c7c0cb",
      "app_id": "WINDOWS_APP:dc6fc68e0403d0c7c0cb",
      "name": "Microsoft Visual C++ 2015-2022 Redistributable (x64)",
      "publisher": "Microsoft Corporation",
      "version": "14.40.33810",
      "path": null,
      "install_location": null,
      "install_date": "20260115",
      "uninstall_available": true,
      "registry_source": "HKLM:\\SOFTWARE\\Microsoft\\Windows\\CurrentVersion\\Uninstall",
      "registry_key": "HKLM:\\SOFTWARE\\Microsoft\\Windows\\CurrentVersion\\Uninstall\\{EXAMPLE-VC-RUNTIME}",
      "winget_visible": null,
      "source": "windows_registry_uninstall",
      "collected_at": "2026-07-06T00:00:00Z"
    },
    {
      "target_id": "WINDOWS_APP:f14af275cd57fed31376",
      "id": "WINDOWS_APP:f14af275cd57fed31376",
      "app_id": "WINDOWS_APP:f14af275cd57fed31376",
      "name": "Example App",
      "publisher": null,
      "version": "1.0",
      "path": "C:\\ExampleApps\\ExampleApp",
      "install_location": "C:\\ExampleApps\\ExampleApp",
      "install_date": "2026-05",
      "uninstall_available": false,
      "registry_source": "HKCU:\\SOFTWARE\\Microsoft\\Windows\\CurrentVersion\\Uninstall",
      "registry_key": "HKCU:\\SOFTWARE\\Microsoft\\Windows\\CurrentVersion\\Uninstall\\ExampleApp",
      "winget_visible": null,
      "source": "windows_registry_uninstall",
      "collected_at": "2026-07-06T00:00:00Z"
    },
    {
      "target_id": "WINDOWS_APP:ed18c088ec132f62fffb",
      "id": "WINDOWS_APP:ed18c088ec132f62fffb",
      "app_id": "WINDOWS_APP:ed18c088ec132f62fffb",
      "name": "Example Toolbar Helper",
      "publisher": "Example Browser Tools",
      "version": "2.1",
      "path": "C:\\ExampleApps\\ToolbarHelper",
      "install_location": "C:\\ExampleApps\\ToolbarHelper",
      "install_date": "20260430",
      "uninstall_available": true,
      "registry_source": "HKCU:\\SOFTWARE\\Microsoft\\Windows\\CurrentVersion\\Uninstall",
      "registry_key": "HKCU:\\SOFTWARE\\Microsoft\\Windows\\CurrentVersion\\Uninstall\\ExampleToolbarHelper",
      "winget_visible": null,
      "source": "windows_registry_uninstall",
      "collected_at": "2026-07-06T00:00:00Z"
    },
    {
      "target_id": "WINDOWS_APP:5ba039f052e64cf8d353",
      "id": "WINDOWS_APP:5ba039f052e64cf8d353",
      "app_id": "WINDOWS_APP:5ba039f052e64cf8d353",
      "name": "Example Vendor Utility",
      "publisher": "Example Hardware Vendor",
      "version": "5.0",
      "path": "C:\\Program Files\\Example Vendor\\Utility",
      "install_location": "C:\\Program Files\\Example Vendor\\Utility",
      "install_date": null,
      "uninstall_available": false,
      "registry_source": "HKLM:\\SOFTWARE\\Microsoft\\Windows\\CurrentVersion\\Uninstall",
      "registry_key": "HKLM:\\SOFTWARE\\Microsoft\\Windows\\CurrentVersion\\Uninstall\\ExampleVendorUtility",
      "winget_visible": null,
      "source": "windows_registry_uninstall",
      "collected_at": "2026-07-06T00:00:00Z",
      "system_component": true
    },
    {
      "target_id": "WINDOWS_APP:4bda7cafc74719636c76",
      "id": "WINDOWS_APP:4bda7cafc74719636c76",
      "app_id": "WINDOWS_APP:4bda7cafc74719636c76",
      "name": "Python 3.x",
      "publisher": "Python Software Foundation",
      "version": "3.x",
      "path": "C:\\ExampleTools\\Python3x",
      "install_location": "C:\\ExampleTools\\Python3x",
      "install_date": "20260201",
      "uninstall_available": true,
      "registry_source": "HKLM:\\SOFTWARE\\Microsoft\\Windows\\CurrentVersion\\Uninstall",
      "registry_key": "HKLM:\\SOFTWARE\\Microsoft\\Windows\\CurrentVersion\\Uninstall\\{EXAMPLE-PYTHON}",
      "winget_visible": null,
      "source": "windows_registry_uninstall",
      "collected_at": "2026-07-06T00:00:00Z"
    },
    {
      "target_id": "WINDOWS_APP:e1aaa3ad609fb3c82875",
      "id": "WINDOWS_APP:e1aaa3ad609fb3c82875",
      "app_id": "WINDOWS_APP:e1aaa3ad609fb3c82875",
      "name": "NVIDIA Example Driver Component",
      "publisher": "NVIDIA Corporation",
      "version": "999.0 Example",
      "path": "C:\\ExampleDrivers\\NVIDIA",
      "install_location": "C:\\ExampleDrivers\\NVIDIA",
      "install_date": "20260312",
      "uninstall_available": true,
      "registry_source": "HKLM:\\SOFTWARE\\WOW6432Node\\Microsoft\\Windows\\CurrentVersion\\Uninstall",
      "registry_key": "HKLM:\\SOFTWARE\\WOW6432Node\\Microsoft\\Windows\\CurrentVersion\\Uninstall\\{EXAMPLE-NVIDIA-DRIVER}",
      "winget_visible": null,
      "source": "windows_registry_uninstall",
      "collected_at": "2026-07-06T00:00:00Z",
      "system_component": true
    }
  ],
  "startup_items": [],
  "services": [],
  "processes": [],
  "schema_version": "0.1.0-pr5"
}
